{
  "$schema": "https://json-schema.org/draft/2020-12/schema",
  "title": "IntentV2",
  "type": "object",
  "required": [
    "version",
    "project_id",
    "project_name",
    "project_weight",
    "features",
    "parallel_groups",
    "agent_config",
    "memory_keys",
    "design_system_source",
    "research_urls",
    "generated_at",
    "brief_hash"
  ],
  "properties": {
    "version": {
      "type": "string",
      "const": "2.0.0",
      "description": "IntentV2 schema version"
    },
    "project_id": {
      "type": "string",
      "pattern": "^[a-z0-9-]+$",
      "description": "Unique project identifier derived from project name"
    },
    "project_name": {
      "type": "string",
      "minLength": 1,
      "maxLength": 120,
      "description": "Human-readable project name from brief"
    },
    "project_weight": {
      "type": "string",
      "enum": ["XS", "S", "M", "L", "XL"],
      "description": "Complexity classification from brief lint"
    },
    "features": {
      "type": "array",
      "minItems": 1,
      "items": {
        "$ref": "#/$defs/Feature"
      },
      "description": "Ordered list of features to implement"
    },
    "parallel_groups": {
      "type": "array",
      "items": {
        "type": "array",
        "items": {
          "type": "string",
          "pattern": "^F[0-9]{2,3}$"
        },
        "minItems": 1
      },
      "description": "Groups of feature IDs that can execute in parallel. Features not in any group execute sequentially."
    },
    "agent_config": {
      "type": "object",
      "additionalProperties": {
        "$ref": "#/$defs/AgentConfig"
      },
      "description": "Per-feature agent configuration. Keys are feature IDs."
    },
    "memory_keys": {
      "type": "array",
      "items": {
        "type": "string",
        "pattern": "^orchestre:"
      },
      "description": "Memory keys persisted by Wave 1 for downstream waves"
    },
    "design_system_source": {
      "type": "string",
      "enum": ["extracted", "generated", "provided"],
      "description": "How the design system was determined. 'extracted' = derived from brief/inspiration URL, 'generated' = created by wave-design agent, 'provided' = user supplied design tokens."
    },
    "research_urls": {
      "type": "array",
      "items": {
        "type": "string",
        "format": "uri"
      },
      "description": "Whitelisted URLs for WebFetch during Wave 3 build"
    },
    "design_tokens": {
      "type": "object",
      "description": "Semantic design tokens extracted or generated. Optional if design_system_source is 'provided' and tokens are in a separate file.",
      "properties": {
        "colors": {
          "type": "object",
          "properties": {
            "primary": { "type": "string" },
            "secondary": { "type": "string" },
            "accent": { "type": "string" },
            "destructive": { "type": "string" },
            "muted": { "type": "string" },
            "background": { "type": "string" },
            "foreground": { "type": "string" },
            "border": { "type": "string" }
          }
        },
        "fonts": {
          "type": "object",
          "properties": {
            "heading": { "type": "string" },
            "body": { "type": "string" },
            "mono": { "type": "string" }
          }
        },
        "radii": {
          "type": "object",
          "properties": {
            "sm": { "type": "string" },
            "md": { "type": "string" },
            "lg": { "type": "string" },
            "full": { "type": "string" }
          }
        }
      }
    },
    "tech_stack": {
      "type": "object",
      "description": "Resolved technology stack",
      "properties": {
        "framework": { "type": "string" },
        "language": { "type": "string" },
        "database": { "type": "string" },
        "auth": { "type": "string" },
        "hosting": { "type": "string" },
        "payment": { "type": "string" },
        "styling": { "type": "string" },
        "state": { "type": "string" }
      }
    },
    "generated_at": {
      "type": "string",
      "format": "date-time",
      "description": "ISO 8601 timestamp of generation"
    },
    "brief_hash": {
      "type": "string",
      "pattern": "^sha256:[a-f0-9]{64}$",
      "description": "SHA-256 hash of the brief that produced this intent"
    }
  },
  "$defs": {
    "Feature": {
      "type": "object",
      "required": ["feature_id", "name", "description", "priority", "category", "files_hint"],
      "properties": {
        "feature_id": {
          "type": "string",
          "pattern": "^F[0-9]{2,3}$",
          "description": "Unique feature identifier (e.g., F01, F02)"
        },
        "name": {
          "type": "string",
          "minLength": 1,
          "maxLength": 80,
          "description": "Short feature name"
        },
        "description": {
          "type": "string",
          "description": "What this feature does and why"
        },
        "priority": {
          "type": "string",
          "enum": ["critical", "high", "medium", "low"],
          "description": "Implementation priority"
        },
        "category": {
          "type": "string",
          "enum": ["auth", "billing", "ui", "api_endpoint", "data_model", "integration", "infrastructure", "design_system"],
          "description": "Feature category for routing and security classification"
        },
        "files_hint": {
          "type": "array",
          "items": { "type": "string" },
          "description": "Expected file paths this feature will create or modify"
        },
        "depends_on": {
          "type": "array",
          "items": {
            "type": "string",
            "pattern": "^F[0-9]{2,3}$"
          },
          "description": "Feature IDs that must complete before this one"
        },
        "acceptance_criteria": {
          "type": "array",
          "items": { "type": "string" },
          "description": "Testable criteria for feature completion"
        }
      }
    },
    "AgentConfig": {
      "type": "object",
      "properties": {
        "model": {
          "type": "string",
          "description": "Model override for this feature's agent (e.g., claude-sonnet-4-20250514 for simpler features)"
        },
        "effort": {
          "type": "string",
          "enum": ["low", "medium", "high"],
          "description": "Effort level controlling token budget and review depth"
        },
        "worktree": {
          "type": "boolean",
          "description": "Whether this feature requires its own git worktree (true if in a parallel group)"
        },
        "hooks": {
          "type": "array",
          "items": { "type": "string" },
          "description": "Hook names that apply to this feature's writes"
        },
        "max_retries": {
          "type": "integer",
          "minimum": 0,
          "maximum": 5,
          "default": 2,
          "description": "Maximum retry attempts on hook or typecheck failure"
        }
      }
    }
  }
}
